{
  "campaign_dir": "/workspaces/MCAD_improve3/reports/article_experiments/sensitivity/e3_controlled_execution/formal_campaigns/virtual_node_count_stage10_c4",
  "contract_version": "mcad-sensitivity-e3-execution-v1",
  "execution_id": "e3-virtual-node-count-stage10-rep_009-strict-common-v1",
  "instance_selection": {
    "instance_ids": [
      "instances/level_000006/rep_009_seed_1767972531",
      "instances/level_000012/rep_009_seed_1767972531",
      "instances/level_000024/rep_009_seed_1767972531"
    ]
  },
  "output_dir": "/workspaces/MCAD_improve3/reports/article_experiments/sensitivity/e3_controlled_execution/runs/virtual_node_count_stage10_rep_009_strict_common",
  "workload_path": "/workspaces/MCAD_improve3/reports/article_experiments/sensitivity/e3_controlled_execution/workloads/virtual_node_count_stage10_rep_009_strict_common.json"
}
