{
  "campaign_dir": "/workspaces/MCAD_improve3/reports/article_experiments/sensitivity/e3_controlled_execution/campaigns/objective_count_stage10_c8_nv32",
  "continue_on_instance_failure": false,
  "contract_version": "mcad-sensitivity-e3-execution-v1",
  "execution_id": "sa5-objective-count-stage10-rep_007-canonical-v1",
  "instance_selection": {
    "instance_ids": [
      "instances/level_000001/rep_007_seed_1363159082",
      "instances/level_000002/rep_007_seed_1363159082",
      "instances/level_000005/rep_007_seed_1363159082",
      "instances/level_000010/rep_007_seed_1363159082",
      "instances/level_000020/rep_007_seed_1363159082",
      "instances/level_000050/rep_007_seed_1363159082"
    ]
  },
  "output_dir": "/workspaces/MCAD_improve3/reports/article_experiments/sensitivity/e3_controlled_execution/runs/objective_count_stage10_rep_007_canonical",
  "workload_path": "/workspaces/MCAD_improve3/reports/article_experiments/sensitivity/e3_controlled_execution/campaigns/objective_count_stage10_c8_nv32/common_workloads/replication_007_seed_1363159082.json"
}
